{
  "token_id": "token_a6e6052395ef",
  "request_id": "appr_req_20260910_195607_bb4695",
  "post_id": "post_e2e_stm32_dma",
  "approved_by": "Serhat",
  "signed_at": "2026-09-10T19:56:07.300314+00:00",
  "expires_at": "2026-09-17T19:56:07.300314+00:00",
  "nonce": "331ff7a00a7345d2988f6e3bbc36ca8a",
  "action_scope": "METRICOOL_SCHEDULE",
  "target_platform": "linkedin",
  "canonical_payload_sha256": "e4593a7bedc667817b358b0f11355d1c4ff8f7518dad5019d3b76dc888c9f201",
  "signature_digest": "97fab0f26a019e8750966d97319785433b13af83b92ec2e9b4e11832981a5ecd"
}