{
  "token_id": "token_efa2d70b0389",
  "request_id": "appr_req_20260910_195720_3c2a72",
  "post_id": "post_e2e_stm32_dma",
  "approved_by": "Serhat",
  "signed_at": "2026-09-10T19:57:20.980927+00:00",
  "expires_at": "2026-09-17T19:57:20.980927+00:00",
  "nonce": "68f0e9d5c8484f0182ea72ca4be70aab",
  "action_scope": "METRICOOL_SCHEDULE",
  "target_platform": "linkedin",
  "canonical_payload_sha256": "e4593a7bedc667817b358b0f11355d1c4ff8f7518dad5019d3b76dc888c9f201",
  "signature_digest": "6dd9ae1be1c420993504bbac4d1029310a13f41e2f6036a1258ab8847bfecfd5"
}